{
  "audience": "response_rich_local",
  "authorityId": "auth_f1ad7de90b763f24",
  "entryEvidence": {
    "pointerByteSha256": "be468f5a39703e2f8c092f651f4fbede0974f0e5c78fe83526d72c3795681316",
    "pointerPath": "contracts/evidence/capability-entry-current.json",
    "records": [
      {
        "recordByteSha256": "b5a5dd286383c27126a7aec13d92e15e84564ce51aa1151fb6b53ac797ec377f",
        "recordId": "623918ac3e6053fdfa0ab06765b71fb05e2a571a4b6d848b4231300a1d9af2e9",
        "recordPath": "contracts/evidence/capability-entry-records/capability-entry-record-623918ac3e6053fdfa0ab06765b71fb05e2a571a4b6d848b4231300a1d9af2e9.json",
        "scope": {
          "capability": "demand_forecast_non_pit",
          "environment": "local",
          "retailerId": "retailer-demo",
          "tenantId": "tenant-demo"
        }
      },
      {
        "recordByteSha256": "66fd121b655d418ab59fb7290f76b14e70932d552b11749d9e2a00cd904359b9",
        "recordId": "3ee56556d3c91622100106150d87c95f48658a3039921d02281bccfd2743fd60",
        "recordPath": "contracts/evidence/capability-entry-records/capability-entry-record-3ee56556d3c91622100106150d87c95f48658a3039921d02281bccfd2743fd60.json",
        "scope": {
          "capability": "inventory_replenishment_current_snapshot",
          "environment": "local",
          "retailerId": "retailer-demo",
          "tenantId": "tenant-demo"
        }
      },
      {
        "recordByteSha256": "d3623fd84a84629060d349aab5822f068f1a10c60b934d21fb00b1891b16cdb6",
        "recordId": "851fc6ab49ad6a3f34f348cae36985f39ddfa993ca2e9816086e18090f7c5891",
        "recordPath": "contracts/evidence/capability-entry-records/capability-entry-record-851fc6ab49ad6a3f34f348cae36985f39ddfa993ca2e9816086e18090f7c5891.json",
        "scope": {
          "capability": "inventory_replenishment_replay",
          "environment": "local",
          "retailerId": "retailer-demo",
          "tenantId": "tenant-demo"
        }
      }
    ]
  },
  "evidenceRoot": "ingestion/data/evidence/run-fc4d492700b127ce-r2",
  "expectedPin": {
    "byteSha256": "714adb65c99d733775c701f920d8feed444e50c5cb9699fe3397a98066a7b31b",
    "path": "contracts/ml/expected-pin.json"
  },
  "jobPurpose": "complete_lineage_rebuild",
  "review": {
    "actor": "nilshah80",
    "reason": "authoritative demo: promote accepted run-2 cohort with measurement_unit + promotion",
    "reviewedAt": "2026-08-14T17:34:55Z"
  },
  "runId": "run-fc4d492700b127ce-r2",
  "schemaVersion": "retail-input-authority/v1",
  "scopes": [
    {
      "capability": "demand_forecast_non_pit",
      "environment": "local",
      "retailerId": "retailer-demo",
      "selectionId": "sel_6dd4ef540a0e11ad",
      "selectionRecordByteSha256": "ddb336c8e8e60fe9f16737bc3230f8fc51931f288767ba8c995168e5881ff343",
      "selectionRecordId": "rec_441910923b74c658",
      "selectionRecordPath": "contracts/evidence/publication-selections/publication-selection-rec_441910923b74c658.json",
      "tenantId": "tenant-demo"
    },
    {
      "capability": "inventory_replenishment_current_snapshot",
      "environment": "local",
      "retailerId": "retailer-demo",
      "selectionId": "sel_18bdf0578e795901",
      "selectionRecordByteSha256": "f56441b6abe6b01594f47f91cd410140fcf1e913c003b5fcdb864539b8c070bd",
      "selectionRecordId": "rec_e8d4239f90d6c891",
      "selectionRecordPath": "contracts/evidence/publication-selections/publication-selection-rec_e8d4239f90d6c891.json",
      "tenantId": "tenant-demo"
    },
    {
      "capability": "inventory_replenishment_replay",
      "environment": "local",
      "retailerId": "retailer-demo",
      "selectionId": "sel_36485d12604abc57",
      "selectionRecordByteSha256": "1626448d0f3afd84ece624607fdd55781b4b023fbf4dc4fdcfb0052ada278cb8",
      "selectionRecordId": "rec_8b80c54c50cb3a0c",
      "selectionRecordPath": "contracts/evidence/publication-selections/publication-selection-rec_8b80c54c50cb3a0c.json",
      "tenantId": "tenant-demo"
    }
  ],
  "semanticIdentityExcludes": [
    "/authorityId",
    "/review"
  ],
  "sourceEvidence": {
    "gateASemanticFingerprint": "1d89bc5d38ccce556bb7e755ca99a6887650a8792d7088a4c40c5a3913b9c568",
    "gateBSemanticFingerprint": "f625e797b79265d726b7b43946a1c59f6f7a455719e469aa7a1f1df362e1c9c2",
    "publicationManifestSha256": "8b68da39787bb50b1e8fea2f971c5216c053cc21da7d9b7a92dc53dae6d03d7b",
    "publicationSemanticFingerprint": "88e882b5486d9f5a3eabf9917ac545e8ef7254f81adb01379eceaa012c07c8cc",
    "readinessReportFingerprint": "c21301d08d493a5f754f8d1857a9275518fc5961dea5d8aeec8e047f7f6e2f40",
    "readinessReportSha256": "91c81719e72c6993eb46dd1f0e6054f3742f2df7f408b792d1055c86701b00af",
    "sourceSnapshotId": "30521d0093057f2652cb1828142cddcabd2c8f8425971f8c58babb7e0957eb5c"
  }
}
