{
  "audience": "response_rich_local",
  "authorityId": "auth_672e39092bdd627e",
  "entryEvidence": {
    "pointerByteSha256": "be468f5a39703e2f8c092f651f4fbede0974f0e5c78fe83526d72c3795681316",
    "pointerPath": "contracts/evidence/capability-entry-current.json",
    "records": [
      {
        "recordByteSha256": "b5a5dd286383c27126a7aec13d92e15e84564ce51aa1151fb6b53ac797ec377f",
        "recordId": "623918ac3e6053fdfa0ab06765b71fb05e2a571a4b6d848b4231300a1d9af2e9",
        "recordPath": "contracts/evidence/capability-entry-records/capability-entry-record-623918ac3e6053fdfa0ab06765b71fb05e2a571a4b6d848b4231300a1d9af2e9.json",
        "scope": {
          "capability": "demand_forecast_non_pit",
          "environment": "local",
          "retailerId": "retailer-demo",
          "tenantId": "tenant-demo"
        }
      },
      {
        "recordByteSha256": "66fd121b655d418ab59fb7290f76b14e70932d552b11749d9e2a00cd904359b9",
        "recordId": "3ee56556d3c91622100106150d87c95f48658a3039921d02281bccfd2743fd60",
        "recordPath": "contracts/evidence/capability-entry-records/capability-entry-record-3ee56556d3c91622100106150d87c95f48658a3039921d02281bccfd2743fd60.json",
        "scope": {
          "capability": "inventory_replenishment_current_snapshot",
          "environment": "local",
          "retailerId": "retailer-demo",
          "tenantId": "tenant-demo"
        }
      },
      {
        "recordByteSha256": "d3623fd84a84629060d349aab5822f068f1a10c60b934d21fb00b1891b16cdb6",
        "recordId": "851fc6ab49ad6a3f34f348cae36985f39ddfa993ca2e9816086e18090f7c5891",
        "recordPath": "contracts/evidence/capability-entry-records/capability-entry-record-851fc6ab49ad6a3f34f348cae36985f39ddfa993ca2e9816086e18090f7c5891.json",
        "scope": {
          "capability": "inventory_replenishment_replay",
          "environment": "local",
          "retailerId": "retailer-demo",
          "tenantId": "tenant-demo"
        }
      }
    ]
  },
  "evidenceRoot": "ingestion/data/evidence/run-fc4d492700b127ce",
  "expectedPin": {
    "byteSha256": "cc3b64337f7045f2d773b82e8e2089ba99c6568b0f46def4bbe62e0d2d5b4f07",
    "path": "contracts/ml/expected-pin.json"
  },
  "jobPurpose": "complete_lineage_rebuild",
  "review": {
    "actor": "nilshah80",
    "reason": "cost-driven Hold calibration run 2",
    "reviewedAt": "2026-08-14T12:16:21Z"
  },
  "runId": "run-fc4d492700b127ce",
  "schemaVersion": "retail-input-authority/v1",
  "scopes": [
    {
      "capability": "demand_forecast_non_pit",
      "environment": "local",
      "retailerId": "retailer-demo",
      "selectionId": "sel_5c97e36d9953fd7c",
      "selectionRecordByteSha256": "fda4f5e8b647f80abfcc8f3dd15b7b3977aee4526d4455e93d49ba21a03133fa",
      "selectionRecordId": "rec_d7e9aae6639e85c2",
      "selectionRecordPath": "contracts/evidence/publication-selections/publication-selection-rec_d7e9aae6639e85c2.json",
      "tenantId": "tenant-demo"
    },
    {
      "capability": "inventory_replenishment_current_snapshot",
      "environment": "local",
      "retailerId": "retailer-demo",
      "selectionId": "sel_878d841b74baf368",
      "selectionRecordByteSha256": "d3ca061acde5cb755cb7aacae8867589bd685eb14928bf40cb3af2d46a048c1b",
      "selectionRecordId": "rec_0c733310b9e33e4f",
      "selectionRecordPath": "contracts/evidence/publication-selections/publication-selection-rec_0c733310b9e33e4f.json",
      "tenantId": "tenant-demo"
    },
    {
      "capability": "inventory_replenishment_replay",
      "environment": "local",
      "retailerId": "retailer-demo",
      "selectionId": "sel_5c8402857fbd20c9",
      "selectionRecordByteSha256": "9186effc62230ccdc6ce881543912c925f2fe8646ae0a32b4ed1a0cae97623ba",
      "selectionRecordId": "rec_aa62e98a83d801f7",
      "selectionRecordPath": "contracts/evidence/publication-selections/publication-selection-rec_aa62e98a83d801f7.json",
      "tenantId": "tenant-demo"
    }
  ],
  "semanticIdentityExcludes": [
    "/authorityId",
    "/review"
  ],
  "sourceEvidence": {
    "gateASemanticFingerprint": "1d89bc5d38ccce556bb7e755ca99a6887650a8792d7088a4c40c5a3913b9c568",
    "gateBSemanticFingerprint": "f625e797b79265d726b7b43946a1c59f6f7a455719e469aa7a1f1df362e1c9c2",
    "publicationManifestSha256": "e197116d771abbfc65db2ee3d3e9abfe3e3a35aa05c0b94408e2db7fea3f5130",
    "publicationSemanticFingerprint": "59c75bbffce4022e023a551821ceccbcb7335b1abc453fc92cb5a8e023d3d9fd",
    "readinessReportFingerprint": "b702f081fae73478e02eadaad3fa895b3e29891ca1c8e5a34695347ca601dc23",
    "readinessReportSha256": "96d567a396b5ebfba67faef096dab93cda9aae1d8cdc4318a0a2aaa4be20acdf",
    "sourceSnapshotId": "30521d0093057f2652cb1828142cddcabd2c8f8425971f8c58babb7e0957eb5c"
  }
}
