{
  "audience": "response_rich_local",
  "authorityId": "auth_e02d18e7b28413c4",
  "entryEvidence": {
    "pointerByteSha256": "be468f5a39703e2f8c092f651f4fbede0974f0e5c78fe83526d72c3795681316",
    "pointerPath": "contracts/evidence/capability-entry-current.json",
    "records": [
      {
        "recordByteSha256": "b5a5dd286383c27126a7aec13d92e15e84564ce51aa1151fb6b53ac797ec377f",
        "recordId": "623918ac3e6053fdfa0ab06765b71fb05e2a571a4b6d848b4231300a1d9af2e9",
        "recordPath": "contracts/evidence/capability-entry-records/capability-entry-record-623918ac3e6053fdfa0ab06765b71fb05e2a571a4b6d848b4231300a1d9af2e9.json",
        "scope": {
          "capability": "demand_forecast_non_pit",
          "environment": "local",
          "retailerId": "retailer-demo",
          "tenantId": "tenant-demo"
        }
      },
      {
        "recordByteSha256": "66fd121b655d418ab59fb7290f76b14e70932d552b11749d9e2a00cd904359b9",
        "recordId": "3ee56556d3c91622100106150d87c95f48658a3039921d02281bccfd2743fd60",
        "recordPath": "contracts/evidence/capability-entry-records/capability-entry-record-3ee56556d3c91622100106150d87c95f48658a3039921d02281bccfd2743fd60.json",
        "scope": {
          "capability": "inventory_replenishment_current_snapshot",
          "environment": "local",
          "retailerId": "retailer-demo",
          "tenantId": "tenant-demo"
        }
      },
      {
        "recordByteSha256": "d3623fd84a84629060d349aab5822f068f1a10c60b934d21fb00b1891b16cdb6",
        "recordId": "851fc6ab49ad6a3f34f348cae36985f39ddfa993ca2e9816086e18090f7c5891",
        "recordPath": "contracts/evidence/capability-entry-records/capability-entry-record-851fc6ab49ad6a3f34f348cae36985f39ddfa993ca2e9816086e18090f7c5891.json",
        "scope": {
          "capability": "inventory_replenishment_replay",
          "environment": "local",
          "retailerId": "retailer-demo",
          "tenantId": "tenant-demo"
        }
      }
    ]
  },
  "evidenceRoot": "ingestion/data/evidence/run-73ba460b02d63c40",
  "expectedPin": {
    "byteSha256": "89594a92d32599cdb67d742062e1c5bc7a56d582f9a4e228b706913118919217",
    "path": "contracts/ml/expected-pin.json"
  },
  "jobPurpose": "complete_lineage_rebuild",
  "review": {
    "actor": "nilshah80",
    "reason": "Authoritative run: competitor model (named rivals), per-unit Price Simulation, promotion positive branch, inventory Bucket A/B/C, migration 0034",
    "reviewedAt": "2026-08-17T13:25:58Z"
  },
  "runId": "run-73ba460b02d63c40",
  "schemaVersion": "retail-input-authority/v1",
  "scopes": [
    {
      "capability": "demand_forecast_non_pit",
      "environment": "local",
      "retailerId": "retailer-demo",
      "selectionId": "sel_6341a864b91d1f4b",
      "selectionRecordByteSha256": "153d6f6c05da0550252d3f4c7a937baf7aed1ba68c017bf7d03b79860e347ed1",
      "selectionRecordId": "rec_50504c3a9b7183e1",
      "selectionRecordPath": "contracts/evidence/publication-selections/publication-selection-rec_50504c3a9b7183e1.json",
      "tenantId": "tenant-demo"
    },
    {
      "capability": "inventory_replenishment_current_snapshot",
      "environment": "local",
      "retailerId": "retailer-demo",
      "selectionId": "sel_34e691c71e4f2a79",
      "selectionRecordByteSha256": "d09edd2d1e5772a3597e3d0f9f22b5bb5d9f22ef9ac655538c74d06631c8bc0d",
      "selectionRecordId": "rec_fc89d279246e65d2",
      "selectionRecordPath": "contracts/evidence/publication-selections/publication-selection-rec_fc89d279246e65d2.json",
      "tenantId": "tenant-demo"
    },
    {
      "capability": "inventory_replenishment_replay",
      "environment": "local",
      "retailerId": "retailer-demo",
      "selectionId": "sel_692d7d53faf3344c",
      "selectionRecordByteSha256": "be4ed6d72c753cb77c98ae2f2b6cbbe3247d57ed0cfbf04d08a1dee706f1beec",
      "selectionRecordId": "rec_3063f3edf693977b",
      "selectionRecordPath": "contracts/evidence/publication-selections/publication-selection-rec_3063f3edf693977b.json",
      "tenantId": "tenant-demo"
    }
  ],
  "semanticIdentityExcludes": [
    "/authorityId",
    "/review"
  ],
  "sourceEvidence": {
    "gateASemanticFingerprint": "96e466ff30316fc81d8d8aee1278898b20511cb4b0d49d60bd9f512343107c14",
    "gateBSemanticFingerprint": "90ebe319fa329fe40b4f387922dcfdcae31839eab4f1fe6e065595e60718baf8",
    "publicationManifestSha256": "9d024ba42f438d47f588eb8bd2759425bb562a6da902b4f28ab247a2ee52bdde",
    "publicationSemanticFingerprint": "f14b9b4a49abaabeb8c9f6ecb2d50368f245eac51845c12b5333b37d15d738a9",
    "readinessReportFingerprint": "4fb44f122d6640a1a62f1c3aa11e11b97cc9a292d4764f14c1728c64d6b0dbf5",
    "readinessReportSha256": "32f1e21a4d5376990735614ebdbc654867b3c0d25a4ddc85cfff4e65ed8541f5",
    "sourceSnapshotId": "eee0e56255843afc10f98783849ff560df9f452ee7954bc6efc98f2a4aac4c00"
  }
}
