{
  "audience": "response_rich_local",
  "authorityId": "auth_68e8d92de64aae1f",
  "entryEvidence": {
    "pointerByteSha256": "be468f5a39703e2f8c092f651f4fbede0974f0e5c78fe83526d72c3795681316",
    "pointerPath": "contracts/evidence/capability-entry-current.json",
    "records": [
      {
        "recordByteSha256": "b5a5dd286383c27126a7aec13d92e15e84564ce51aa1151fb6b53ac797ec377f",
        "recordId": "623918ac3e6053fdfa0ab06765b71fb05e2a571a4b6d848b4231300a1d9af2e9",
        "recordPath": "contracts/evidence/capability-entry-records/capability-entry-record-623918ac3e6053fdfa0ab06765b71fb05e2a571a4b6d848b4231300a1d9af2e9.json",
        "scope": {
          "capability": "demand_forecast_non_pit",
          "environment": "local",
          "retailerId": "retailer-demo",
          "tenantId": "tenant-demo"
        }
      },
      {
        "recordByteSha256": "66fd121b655d418ab59fb7290f76b14e70932d552b11749d9e2a00cd904359b9",
        "recordId": "3ee56556d3c91622100106150d87c95f48658a3039921d02281bccfd2743fd60",
        "recordPath": "contracts/evidence/capability-entry-records/capability-entry-record-3ee56556d3c91622100106150d87c95f48658a3039921d02281bccfd2743fd60.json",
        "scope": {
          "capability": "inventory_replenishment_current_snapshot",
          "environment": "local",
          "retailerId": "retailer-demo",
          "tenantId": "tenant-demo"
        }
      },
      {
        "recordByteSha256": "d3623fd84a84629060d349aab5822f068f1a10c60b934d21fb00b1891b16cdb6",
        "recordId": "851fc6ab49ad6a3f34f348cae36985f39ddfa993ca2e9816086e18090f7c5891",
        "recordPath": "contracts/evidence/capability-entry-records/capability-entry-record-851fc6ab49ad6a3f34f348cae36985f39ddfa993ca2e9816086e18090f7c5891.json",
        "scope": {
          "capability": "inventory_replenishment_replay",
          "environment": "local",
          "retailerId": "retailer-demo",
          "tenantId": "tenant-demo"
        }
      }
    ]
  },
  "evidenceRoot": "ingestion/data/evidence/run-e30369022fa0209c",
  "expectedPin": {
    "byteSha256": "eff5d23583fcca62429820be93c4792dd5431bed14362192edbaca1b2965cdb5",
    "path": "contracts/ml/expected-pin.json"
  },
  "jobPurpose": "complete_lineage_rebuild",
  "review": {
    "actor": "nilay.shah",
    "reason": "Approved final response-rich local lineage for forecast, inventory, and pricing evaluation",
    "reviewedAt": "2026-08-12T09:27:19Z"
  },
  "runId": "run-e30369022fa0209c",
  "schemaVersion": "retail-input-authority/v1",
  "scopes": [
    {
      "capability": "demand_forecast_non_pit",
      "environment": "local",
      "retailerId": "retailer-demo",
      "selectionId": "sel_247453632ae956ac",
      "selectionRecordByteSha256": "478cb7664f7a181a01789d7a42b42061d3d4837da7e0edd495cda82f55166941",
      "selectionRecordId": "rec_0c9af5e4d419ca2d",
      "selectionRecordPath": "contracts/evidence/publication-selections/publication-selection-rec_0c9af5e4d419ca2d.json",
      "tenantId": "tenant-demo"
    },
    {
      "capability": "inventory_replenishment_current_snapshot",
      "environment": "local",
      "retailerId": "retailer-demo",
      "selectionId": "sel_10ff3d0c180b30d3",
      "selectionRecordByteSha256": "a7b5c398546c38717c6f672f0b2ba5ef5182813952d4e4ce52b5bf2c1331d3df",
      "selectionRecordId": "rec_e3df4ed456ed22c9",
      "selectionRecordPath": "contracts/evidence/publication-selections/publication-selection-rec_e3df4ed456ed22c9.json",
      "tenantId": "tenant-demo"
    },
    {
      "capability": "inventory_replenishment_replay",
      "environment": "local",
      "retailerId": "retailer-demo",
      "selectionId": "sel_4003bd9bee17976a",
      "selectionRecordByteSha256": "44f12636dea30f3f94944ff5d761a45677445737daf4524f1895fc85612cd297",
      "selectionRecordId": "rec_46571f40c14a3fcb",
      "selectionRecordPath": "contracts/evidence/publication-selections/publication-selection-rec_46571f40c14a3fcb.json",
      "tenantId": "tenant-demo"
    }
  ],
  "semanticIdentityExcludes": [
    "/authorityId",
    "/review"
  ],
  "sourceEvidence": {
    "gateASemanticFingerprint": "c5feb3a0b879b8567fc54dd7484b6718ba1c4b9ef07bc77a4a5ab4c86940d6a4",
    "gateBSemanticFingerprint": "3c49aa881873e992768179605f4a59e8e8afd78fe0000bcbdd43d7eedc448de6",
    "publicationManifestSha256": "9aef623889989df7d343056d1f94e9e7bb0c35fc190837a8f23cc7db6eb833f7",
    "publicationSemanticFingerprint": "f9950a36f28c6e9849e87ac7274488ff04ae7b8f48366c36eafd91c0d69a2952",
    "readinessReportFingerprint": "2e78f3b628f6454a52917c536f719ed839172169602492540bc64b3a7b2f12d9",
    "readinessReportSha256": "7087b5f178a3c0e1b8c201c777564add8fc352c53adb65fd2286113cb7fb8e97",
    "sourceSnapshotId": "62a01e3058d7215c7559c29e8b3a5c9e56dae73bb2f820b1f264ff9d6a47922b"
  }
}
